{
  "$schema": "https://json-schema.org/draft/2020-12/schema",
  "schema": "schindler-control-catalog",
  "schema_version": "0.2.0",
  "title": "Schindler 2.0 Control Catalog — v0.2.0",
  "description": "Inventory of all operator-tunable controls + read-only status on the iter5-1080p-clean substrate as of 2026-05-31. Sourced from sw/phase-b/src/main.c UART command handlers + iter14 kernel-mode toggle + Mackin alpha. This catalog is the single source of truth that the schindlerd daemon, web UI, and RP2040 front-panel firmware all generate code from. Future catalog versions add controls as features land; semver applies (patch = bug, minor = add, major = remove/rename/retype).",
  "generated_at": "2026-05-31",
  "source_substrate": {
    "branch": "iter5-1080p-clean",
    "tip": "ef307b6",
    "archive_tag": "iter5-1080p-clean-720p-scaler_top-enable-abb83e8"
  },

  "categories": [
    { "id": "color",   "title": "Color", "description": "Saturation, per-channel level (black/white), and 3×3 matrix transforms applied between MM2S and axis_to_vid_io." },
    { "id": "scaler",  "title": "Scaler", "description": "iter14 runtime kernel-mode selection for the H and V downscalers. Production default = 2-tap boxcar; NN sharpens at cost of dropped cols/rows; 4-tap softens." },
    { "id": "frc",     "title": "FRC", "description": "Mackin alpha for temporal blending (Phase E2 — wiring is currently placeholder; alpha will be load-bearing once dual-VDMA wiring lands)." },
    { "id": "system",  "title": "System", "description": "Reset, identity, and meta commands." },
    { "id": "status",  "title": "Status", "description": "Read-only telemetry exposed via DIAG print. v0.2.0 adds source/output rate fields driven by the firmware DIAG line; future versions add more granular metrics." }
  ],

  "controls": [
    {
      "id": "color.saturation",
      "title": "Saturation",
      "category": "color",
      "type": "number",
      "unit": "percent",
      "range": [0, 200],
      "default": 100,
      "persistent": true,
      "surface": ["front", "web"],
      "uart_command": "s <pct>",
      "hdl_module": "color_saturation",
      "axi_gpio_register": "axi_gpio_3.ch1 [15:0] (Q1.15)",
      "encoding": "q1_15",
      "notes": "0 = grayscale; 100 = identity; 200 = roughly 2× chroma. Implements Rec.601 luma-mix saturation."
    },
    {
      "id": "color.matrix_saturation",
      "title": "Matrix Saturation",
      "category": "color",
      "type": "number",
      "unit": "percent",
      "range": [0, 200],
      "default": 100,
      "persistent": true,
      "surface": ["front", "web"],
      "uart_command": "m <pct>",
      "hdl_module": "color_matrix",
      "axi_gpio_register": "axi_gpio_4/5/6 (3×3 matrix coefficients derived from sat percent)",
      "encoding": "q2_14_matrix",
      "notes": "Alternative saturation via the full 3×3 matrix path instead of the luma-mix shortcut. 0 = grayscale, 100 = identity. Setting either color.saturation or this overrides the matrix; cannot be used simultaneously."
    },
    {
      "id": "color.correct.black_r",
      "title": "Black level R",
      "category": "color",
      "type": "number",
      "unit": "raw8",
      "range": [0, 255],
      "default": 0,
      "persistent": true,
      "surface": ["front", "web"],
      "uart_command": "b <r> <g> <b>",
      "hdl_module": "color_correct",
      "axi_gpio_register": "axi_gpio_3.ch1 [23:16]",
      "encoding": "u8"
    },
    {
      "id": "color.correct.black_g",
      "title": "Black level G",
      "category": "color",
      "type": "number",
      "unit": "raw8",
      "range": [0, 255],
      "default": 0,
      "persistent": true,
      "surface": ["front", "web"],
      "uart_command": "b <r> <g> <b>",
      "axi_gpio_register": "axi_gpio_3.ch1 [31:24]",
      "encoding": "u8"
    },
    {
      "id": "color.correct.black_b",
      "title": "Black level B",
      "category": "color",
      "type": "number",
      "unit": "raw8",
      "range": [0, 255],
      "default": 0,
      "persistent": true,
      "surface": ["front", "web"],
      "uart_command": "b <r> <g> <b>",
      "axi_gpio_register": "axi_gpio_3.ch2 [7:0]",
      "encoding": "u8"
    },
    {
      "id": "color.correct.white_r",
      "title": "White level R",
      "category": "color",
      "type": "number",
      "unit": "raw8",
      "range": [0, 255],
      "default": 255,
      "persistent": true,
      "surface": ["front", "web"],
      "uart_command": "w <r> <g> <b>",
      "axi_gpio_register": "axi_gpio_3.ch2 [15:8]",
      "encoding": "u8"
    },
    {
      "id": "color.correct.white_g",
      "title": "White level G",
      "category": "color",
      "type": "number",
      "unit": "raw8",
      "range": [0, 255],
      "default": 255,
      "persistent": true,
      "surface": ["front", "web"],
      "uart_command": "w <r> <g> <b>",
      "axi_gpio_register": "axi_gpio_3.ch2 [23:16]",
      "encoding": "u8"
    },
    {
      "id": "color.correct.white_b",
      "title": "White level B",
      "category": "color",
      "type": "number",
      "unit": "raw8",
      "range": [0, 255],
      "default": 255,
      "persistent": true,
      "surface": ["front", "web"],
      "uart_command": "w <r> <g> <b>",
      "axi_gpio_register": "axi_gpio_3.ch2 [31:24]",
      "encoding": "u8"
    },
    {
      "id": "color.matrix.preset",
      "title": "Color matrix preset",
      "category": "color",
      "type": "enum",
      "options": [
        { "value": "identity",    "label": "Identity (full color)",      "uart_command": "i" },
        { "value": "grayscale",   "label": "Rec.601 grayscale",          "uart_command": "g" },
        { "value": "custom",      "label": "Custom (advanced)",          "uart_command": null }
      ],
      "default": "identity",
      "persistent": true,
      "surface": ["front", "web"],
      "hdl_module": "color_matrix",
      "notes": "Identity zeros out matrix saturation; grayscale forces it to 0. Custom mode preserves the matrix state set by color.matrix_saturation or future custom 9-coefficient + 3-offset writes."
    },

    {
      "id": "scaler.kernel_h",
      "title": "Scaler H kernel mode",
      "category": "scaler",
      "type": "enum",
      "options": [
        { "value": "nn",         "label": "Nearest neighbor (sharpest; drops cols)" },
        { "value": "boxcar_2tap","label": "2-tap boxcar (production)" },
        { "value": "boxcar_4tap","label": "4-tap boxcar (softer)" },
        { "value": "reserved",   "label": "Reserved" }
      ],
      "default": "boxcar_2tap",
      "persistent": true,
      "surface": ["front", "web"],
      "uart_command": "k h <0-3>",
      "hdl_module": "scaler_h",
      "axi_gpio_register": "axi_gpio_7 [1:0]",
      "encoding": "u2",
      "requires_iter": 14
    },
    {
      "id": "scaler.kernel_v",
      "title": "Scaler V kernel mode",
      "category": "scaler",
      "type": "enum",
      "options": [
        { "value": "nn",         "label": "Nearest neighbor (sharpest; drops rows)" },
        { "value": "boxcar_2tap","label": "2-tap boxcar (production)" },
        { "value": "boxcar_4tap","label": "4-tap boxcar (softer)" },
        { "value": "reserved",   "label": "Reserved" }
      ],
      "default": "boxcar_2tap",
      "persistent": true,
      "surface": ["front", "web"],
      "uart_command": "k v <0-3>",
      "hdl_module": "scaler_v",
      "axi_gpio_register": "axi_gpio_7 [3:2]",
      "encoding": "u2",
      "requires_iter": 14
    },

    {
      "id": "frc.mackin_alpha",
      "title": "Mackin temporal blend alpha",
      "category": "frc",
      "type": "number",
      "unit": "q1_15",
      "range": [0, 32768],
      "default": 32768,
      "persistent": true,
      "surface": ["front", "web"],
      "uart_command": "a <hex>",
      "hdl_module": "mackin_blender",
      "axi_gpio_register": "axi_gpio_3 (Mackin alpha — branch-specific)",
      "encoding": "q1_15",
      "notes": "0x8000 = use current frame only (no blend, equivalent to drop/repeat). 0x4000 = 50/50 blend of current and previous frames. 0x0000 = use previous frame only. CURRENT STATE: bench wiring is placeholder axis_clone — both VDMA paths feed the same frame so alpha has no visible effect until dual-VDMA wiring lands.",
      "requires_branch": "mackin-impl-wip",
      "requires_status": "placeholder"
    },

    {
      "id": "system.reset",
      "title": "Reset to defaults",
      "category": "system",
      "type": "trigger",
      "surface": ["front", "web"],
      "uart_command": "i",
      "notes": "Identity color matrix, sat=100%, black=(0,0,0), white=(255,255,255). Does NOT reset scaler kernel modes (those persist until explicitly changed)."
    },
    {
      "id": "system.help",
      "title": "Print help",
      "category": "system",
      "type": "trigger",
      "surface": [],
      "uart_command": "?",
      "notes": "UART-only — surface=[] means it doesn't appear in operator UIs."
    },
    {
      "id": "system.readback",
      "title": "Re-print GPIO readbacks",
      "category": "system",
      "type": "trigger",
      "surface": [],
      "uart_command": "r",
      "notes": "UART-only diagnostic."
    },

    {
      "id": "status.s2mm_sr",
      "title": "S2MM status register",
      "category": "status",
      "type": "number",
      "unit": "hex32",
      "read_only": true,
      "poll_interval_ms": 1000,
      "axi_register": "VDMA S2MM_SR @ 0x4 (base TBD by xparameters.h)",
      "encoding": "u32_bitfield",
      "bitfield_legend": {
        "0x80":  "SOFEarly",
        "0x100": "EOLEarly",
        "0x800": "SOFLate (suppressed in DIAG; cosmetic post-iter6)",
        "0x1000":"FrmCnt (benign per PG020)",
        "0x8000":"EOLLate (real error)"
      },
      "surface": ["web"]
    },
    {
      "id": "status.mm2s_sr",
      "title": "MM2S status register",
      "category": "status",
      "type": "number",
      "unit": "hex32",
      "read_only": true,